<?xml version="1.0" encoding="UTF-8" ?>
<!DOCTYPE ParameterSystem SYSTEM "../dtds/parameters2.dtd" >

<!-- FIXME point to  SYSTEM "http://www.virtual-worlds.biz/dtds/parameters2.dtd"  -->


<ParameterSystem name="PolicyVariables" instanceName="policyVariables" enabled="true">
        <ParameterSystem name="SummaryBlock" instanceName="summaryBlock" enabled="true">
                <Description type="journalese" lang="en">Selected Macroeconomic Indicators</Description>
                <Description type="label" lang="en">Selected Macroeconomic Indicators</Description>
                <Description type="description" lang="en">Selected Macroeconomic Indicators</Description>
                <ParameterSystem name="SummaryBlockExpenditure" instanceName="summaryBlockExpenditure" enabled="true">
                        <Description type="journalese" lang="en">Real expenditure on GDP (Rbn at constant 2000 market prices)</Description>
                        <Description type="label" lang="en">Real expenditure (Rbn at constant 2000 market prices)</Description>
                        <Description type="description" lang="en">Real expenditure on GDP (Rbn at constant 2000 market prices)</Description>
                        <Parameter instanceName="gdpAtMarketPrices" type="real">
                                <Description type="journalese" lang="en">GDP at Market Prices</Description>
                                <Description type="label" lang="en">GDP at Market Prices</Description>
                                <Description type="description" lang="en">GDP at Market Prices</Description>
                                <EditInfo sumsTo100="false" macroVariableClass="3" levelChangePossible="true" isExogenous="false" outputFileStartPos="18" numVariables="1" percentChangePossible="true"/>
                        </Parameter>
                        <Parameter instanceName="privateConsumption" type="real">
                                <Description type="journalese" lang="en">Private consumption</Description>
                                <Description type="label" lang="en">Private consumption</Description>
                                <Description type="description" lang="en">Private consumption</Description>
                                <EditInfo sumsTo100="false" macroVariableClass="3" levelChangePossible="true" isExogenous="false" outputFileStartPos="3" numVariables="1" percentChangePossible="true"/>
                        </Parameter>
                        <Parameter instanceName="governmentConsumption" type="real">
                                <Description type="journalese" lang="en">Government consumption</Description>
                                <Description type="label" lang="en">Government consumption</Description>
                                <Description type="description" lang="en">Government consumption</Description>
                                <EditInfo sumsTo100="false" macroVariableClass="3" levelChangePossible="true" isExogenous="false" outputFileStartPos="4" numVariables="1" percentChangePossible="true"/>
                        </Parameter>
                        <Parameter instanceName="investment" type="real">
                                <Description type="journalese" lang="en">Investment</Description>
                                <Description type="label" lang="en">Investment</Description>
                                <Description type="description" lang="en">Investment</Description>
                                <EditInfo sumsTo100="false" macroVariableClass="3" levelChangePossible="true" isExogenous="false" outputFileStartPos="7" numVariables="1" percentChangePossible="true"/>
                        </Parameter>
                        <Parameter instanceName="exports" type="real">
                                <Description type="journalese" lang="en">Exports of goods  and  services</Description>
                                <Description type="label" lang="en">Exports of goods  and  services</Description>
                                <Description type="description" lang="en">Exports of goods  and  services</Description>
                                <EditInfo sumsTo100="false" macroVariableClass="3" levelChangePossible="true" isExogenous="false" outputFileStartPos="12" numVariables="1" percentChangePossible="true"/>
                        </Parameter>
                        <Parameter instanceName="imports" type="real">
                                <Description type="journalese" lang="en">Imports of goods  and  services</Description>
                                <Description type="label" lang="en">Imports of goods  and  services</Description>
                                <Description type="description" lang="en">Imports of goods  and  services</Description>
                                <EditInfo sumsTo100="false" macroVariableClass="3" levelChangePossible="true" isExogenous="false" outputFileStartPos="17" numVariables="1" percentChangePossible="true"/>
                        </Parameter>
                        <Parameter instanceName="grossDomesticExpenditure" type="real">
                                <Description type="journalese" lang="en">Gross Domestic Expenditure (GDE)</Description>
                                <Description type="label" lang="en">Gross Domestic Expenditure</Description>
                                <Description type="description" lang="en">Gross Domestic Expenditure (GDE)</Description>
                                <EditInfo sumsTo100="false" macroVariableClass="3" levelChangePossible="true" isExogenous="false" outputFileStartPos="11" numVariables="1" percentChangePossible="true"/>
                        </Parameter>
                </ParameterSystem>
                <ParameterSystem name="SummaryBlockExpenditureGrowth" instanceName="summaryBlockExpenditureGrowth" enabled="true">
                        <Description type="journalese" lang="en">Real expenditure on GDP (% change)</Description>
                        <Description type="label" lang="en">Real expenditure Growth (% change)</Description>
                        <Description type="description" lang="en">Real expenditure on GDP (% change)</Description>
                        <Parameter instanceName="gdpAtMarketPrices" type="real">
                                <Description type="journalese" lang="en">GDP at Market Prices</Description>
                                <Description type="label" lang="en">GDP at Market Prices</Description>
                                <Description type="description" lang="en">GDP at Market Prices</Description>
                                <EditInfo treatAsPercentage="true" sumsTo100="false" macroVariableClass="3" levelChangePossible="true" isExogenous="false" outputFileStartPos="10018" numVariables="1" percentChangePossible="true"/>
                        </Parameter>
                        <Parameter instanceName="privateConsumption" type="real">
                                <Description type="journalese" lang="en">Private consumption</Description>
                                <Description type="label" lang="en">Private consumption</Description>
                                <Description type="description" lang="en">Private consumption</Description>
                                <EditInfo treatAsPercentage="true" sumsTo100="false" macroVariableClass="3" levelChangePossible="true" isExogenous="false" outputFileStartPos="10003" numVariables="1" percentChangePossible="true"/>
                        </Parameter>
                        <Parameter instanceName="governmentConsumption" type="real">
                                <Description type="journalese" lang="en">Government consumption</Description>
                                <Description type="label" lang="en">Government consumption</Description>
                                <Description type="description" lang="en">Government consumption</Description>
                                <EditInfo treatAsPercentage="true" sumsTo100="false" macroVariableClass="3" levelChangePossible="true" isExogenous="false" outputFileStartPos="10004" numVariables="1" percentChangePossible="true"/>
                        </Parameter>
                        <Parameter instanceName="investment" type="real">
                                <Description type="journalese" lang="en">Investment</Description>
                                <Description type="label" lang="en">Investment</Description>
                                <Description type="description" lang="en">Investment</Description>
                                <EditInfo treatAsPercentage="true" sumsTo100="false" macroVariableClass="3" levelChangePossible="true" isExogenous="false" outputFileStartPos="10007" numVariables="1" percentChangePossible="true"/>
                        </Parameter>
                        <Parameter instanceName="exports" type="real">
                                <Description type="journalese" lang="en">Exports of goods  and  services</Description>
                                <Description type="label" lang="en">Exports of goods  and  services</Description>
                                <Description type="description" lang="en">Exports of goods  and  services</Description>
                                <EditInfo treatAsPercentage="true" sumsTo100="false" macroVariableClass="3" levelChangePossible="true" isExogenous="false" outputFileStartPos="10012" numVariables="1" percentChangePossible="true"/>
                        </Parameter>
                        <Parameter instanceName="imports" type="real">
                                <Description type="journalese" lang="en">Imports of goods  and  services</Description>
                                <Description type="label" lang="en">Imports of goods  and  services</Description>
                                <Description type="description" lang="en">Imports of goods  and  services</Description>